,Product_Name,Source,Ratings,Brand,Price,Actual_price,Category
0,DZAB Assemble Core i3 (4 GB DDR3/500 GB/Windows 7 Home Basic/15.1 Inch Screen/dI3/4GB/500/15.1),https://rukminim2.flixcart.com/image/612/612/l071d3k0/allinone-desktop/m/3/5/di3-4gb-500-15-4-dzab-original-imagcf9hgvgz3uzd.jpeg?q=70,3.7,DZAB,"7,999","23,999",Desktop PC
1,"ASUS Vivo AiO V222, All in One Desktop, Intel Pentium Quad Core (8 GB DDR4/256 GB SSD/Windows 11 Home/21.5 Inch Screen/V222GAK-WA037W)",https://rukminim2.flixcart.com/image/612/612/xif0q/allinone-desktop/a/y/a/-original-imagtvpxrzjrapg4.jpeg?q=70,4.4,ASUS,"30,990","45,990",Desktop PC
2,DZAB Intel Core i5 (8 GB DDR3/500 GB/128 GB SSD/Windows 11 Home/1 GB/19 Inch Screen/AIC-i52400-8-500-128-19-11Inch-Window 11),https://rukminim2.flixcart.com/image/612/612/xif0q/allinone-desktop/f/l/w/aic-i52400-8-500-128-19-11inch-window-11-dzab-original-imagtsf3mkhzah4y.jpeg?q=70,4.0,DZAB,"11,995","39,999",Desktop PC
3,FusionIT 2000 Core i5 (8 GB DDR3/1 TB/128 GB SSD/Windows 11 Home/20 Inch Screen/FusionIT_i5) with MS Office,https://rukminim2.flixcart.com/image/612/612/xif0q/allinone-desktop/r/m/o/core-i3-processor-keyboard-and-mouse-and-wifi-and-bluetooth-original-imagruhkhmhhd4n9.jpeg?q=70,3.9,FusionIT,"11,290","49,000",Desktop PC
4,DZAB Intel Core i3 (8 GB DDR3/500 GB/128 GB SSD/Windows 11 Home/1 GB/19 Inch Screen/AIC-D-i32100-8-500-128-19Inch-Window 11),https://rukminim2.flixcart.com/image/612/612/xif0q/allinone-desktop/o/e/j/aic-d-i32100-8-500-128-19inch-window-11-dzab-original-imagu8qqmhguf2bh.jpeg?q=70,3.6,DZAB,"9,999","35,999",Desktop PC
5,TECH- Assemblers Assembled Desktop Core i5 (8 GB DDR3/500 GB/128 GB SSD/Windows 10 Pro/512 MB/19 Inch Screen/i5-500-128-19-wifi),https://rukminim2.flixcart.com/image/612/612/xif0q/allinone-desktop/s/o/k/i5-500-128-19-wifi-tech-assemblers-original-imagtj9wgzhveghm.jpeg?q=70,3.5,TECH-,"13,589","39,999",Desktop PC
6,ASSEMBLD 2000 Core i3 (8 GB DDR3/1 TB/128 GB SSD/Windows 11 Home/20 Inch Screen/ASSEMBLED PC) with MS Office,https://rukminim2.flixcart.com/image/612/612/xif0q/allinone-desktop/n/a/t/assembled-pc-wifi-bluetooth-keyboard-and-mouse-hp-fusionit-original-imagsrewzefxmcuh.jpeg?q=70,3.5,ASSEMBLD,"10,999","39,999",Desktop PC
7,DZAB Assembled Core i3 (4 GB DDR3/500 GB/Windows 7 Home Basic/18.5 Inch Screen/dI3/4GB/500/18.5),https://rukminim2.flixcart.com/image/612/612/kua4r680/desktop-computer/o/w/t/intechvisioni32102-intechvision-original-imag7fv2sngkkghn.jpeg?q=70,3.2,DZAB,"9,999","29,999",Desktop PC
8,HP All-in-One Core i5 (11th Gen) (8 GB DDR4/512 GB SSD/Windows 11 Home/Intel Graphics/23.8 Inch Screen/24-df1229in) with MS Office,https://rukminim2.flixcart.com/image/612/612/xif0q/allinone-desktop/s/e/c/24-df1229in-hp-original-imagq5fytg2kmcgg.jpeg?q=70,4.8,HP,"60,199","62,990",Desktop PC
9,Assembled Gaming & Editing Desktops Core i7 (850) Core i7 (16 GB DDR4/512 GB SSD/Windows 11 Home/2 GB/19 Inch Screen/Gaming & Editing Desktops Core i7 -850 Core i7 (16 GB DDR3/512 GB SSD/) with MS Office,https://rukminim2.flixcart.com/image/612/612/xif0q/cpu/n/l/t/3-0-bold-gaming-youtube-editing-desktop-500-zoonis-original-imagzhtufszgqbw2.jpeg?q=70,4.5,Assembled,"19,999","49,999",Desktop PC
10,ZOONIS Home & Office Core i5 (8 GB DDR3/500 GB/128 GB SSD/Windows 10 Pro/19 Inch Screen/Home & Office Core i5 Premium Desktop Complete Set 8 GB DDR3/500 GB/128 GB SSD/) with MS Office,https://rukminim2.flixcart.com/image/612/612/xif0q/allinone-desktop/e/9/l/ma-10-gaming-pc-for-gta-free-fire-zoonis-original-imagnnya8fkfgrsh.jpeg?q=70,3.1,ZOONIS,"13,261","49,999",Desktop PC
11,rionix G2 Core i5 (8 GB DDR3/500 GB/120 GB SSD/Windows 11 Home/18.5 Inch Screen/core i5 2400/8gb/18.5),https://rukminim2.flixcart.com/image/612/612/xif0q/allinone-desktop/t/a/w/190-10-190-08-g2-rionix-original-imagsfb3cnq3fgz6.jpeg?q=70,4.2,rionix,"11,294","49,999",Desktop PC
12,HP HP All-in-One 22-dd Celeron Dual Core (8 GB DDR4/500 GB/Windows 11 Home/21.5 Inch Screen/22-dd2986in) with MS Office,https://rukminim2.flixcart.com/image/612/612/xif0q/allinone-desktop/o/3/2/22-dd2986in-hp-original-imagpwehe6kzqdfm.jpeg?q=70,4.0,HP,"36,190","46,990",Desktop PC
13,rionix G3 Core i5 (4 GB DDR3/500 GB/120 GB SSD/Windows 10 Pro/15 Inch Screen/190-10/190-08/ G2),https://rukminim2.flixcart.com/image/612/612/xif0q/allinone-desktop/h/l/n/rio-4gb-500gb-rionix-original-imagsrkb3puar8fw.jpeg?q=70,4.4,rionix,"11,200","60,999",Desktop PC
14,FusionIT Assembled 2000 Core i7 (16 GB DDR4/1 TB/256 GB SSD/Windows 11 Home/512 MB/20 Inch Screen/ASSEMBLED PC_WIFI_BLUETOOTH_KEYBOARD AND MOUSE HP) with MS Office,https://rukminim2.flixcart.com/image/612/612/xif0q/allinone-desktop/n/a/t/assembled-pc-wifi-bluetooth-keyboard-and-mouse-hp-fusionit-original-imagsrewzefxmcuh.jpeg?q=70,3.5,FusionIT,"16,450","56,990",Desktop PC
15,HP All-in-One Core i5 (8 GB DDR4/1 TB/256 GB SSD/Windows 11 Home/Intel Graphics/23.8 Inch Screen/24-cb1902in) with MS Office,https://rukminim2.flixcart.com/image/612/612/xif0q/allinone-desktop/b/w/t/24-cb1901in-hp-original-imagnyk6y9ugzfeg.jpeg?q=70,5.0,HP,"65,802","75,499",Desktop PC
16,DZAB Intel Core i5 (8 GB DDR3/512 GB SSD/Windows 11 Home/1 GB/22 Inch Screen/AIC-i52400-8-512SSD-22Inch-Window 11),https://rukminim2.flixcart.com/image/612/612/xif0q/allinone-desktop/v/1/b/aic-i52400-8-512ssd-22inch-window-11-dzab-original-imagtsfdmhf6xzff.jpeg?q=70,4.0,DZAB,"13,989","41,999",Desktop PC
17,ZOONIS Gaming & YouTube Editing Core i5 (4th Gen) (16 GB DDR4/512 GB SSD/Windows 10 Pro/4 GB/22 Inch Screen/Gaming & YouTube Editing Desktop With 4GB Graphics Card Core i5 (4th Gen)) with MS Office,https://rukminim2.flixcart.com/image/612/612/xif0q/allinone-desktop/c/j/x/gaming-youtube-editing-desktop-with-4gb-graphics-card-core-i5-original-imagrqzwqehxh2da.jpeg?q=70,2.0,ZOONIS,"28,999","64,999",Desktop PC
18,ASSEMBLD 2630 Core i7 (16 GB DDR4/1 TB/128 GB SSD/Windows 11 Home/20 Inch Screen/Assembled PC) with MS Office,https://rukminim2.flixcart.com/image/612/612/xif0q/allinone-desktop/s/q/s/assembled-pc-assembld-original-imagmxptgjcw7vgx.jpeg?q=70,3.5,ASSEMBLD,"15,080","64,999",Desktop PC
19,APPLE 2021 iMac with 4.5K Retina display M1 (8 GB Unified/512 GB SSD/Mac OS Big Sur/24 Inch Screen/MGPN3HN/A),https://rukminim2.flixcart.com/image/612/612/kp1imq80/allinone-desktop/w/k/v/mjva3hn-a-apple-original-imag3d5tvzyza8cv.jpeg?q=70,4.2,APPLE,"1,49,990","1,59,900",Desktop PC
20,TECH- Assemblers Basic Core i3 (4 GB DDR3/500 GB/Windows 10 Pro/15 Inch Screen/1702),https://rukminim2.flixcart.com/image/612/612/xif0q/allinone-desktop/j/d/v/1702-tech-assemblers-original-imagqtcfsnxrqtcz.jpeg?q=70,4.1,TECH-,"9,372","19,999",Desktop PC
21,Assembled Core i7-2600 Core i7 (16 GB DDR4/1 TB/128 GB SSD/Windows 11 Home/19 Inch Screen/Samsung Monitor_FusionIT PC_Keyboard and Mouse) with MS Office,https://rukminim2.flixcart.com/image/612/612/xif0q/desktop-computer/r/y/r/0-assembled-core-i7-fusionit-original-imagtvs3jhnkhasv.jpeg?q=70,3.3,Assembled,"17,244","69,870",Desktop PC
22,ASSEMBLD CORE I5 Core i5 (8 GB DDR3/1 TB/128 GB SSD/Windows 10 Pro/1 GB NO/20 Inch Screen/IMPACT ASSEMBLED) with MS Office,https://rukminim2.flixcart.com/image/612/612/kljrvrk0/desktop-computer/9/e/k/ent2gb8gb-002-entwino-original-imagyn3jfmz5ugjz.jpeg?q=70,3.1,ASSEMBLD,"11,992","49,999",Desktop PC
23,TECH- Assemblers Intel Core 2 Duo (4 GB DDR2/320 GB/Windows 7 Ultimate/0.512 GB Intel Shared Memory/15.1 Inch Screen/ASZC2D4GB320GB),https://rukminim2.flixcart.com/image/612/612/xif0q/allinone-desktop/s/s/i/aszc2d4gb320gb-tech-assemblers-original-imagqr6ggdgrnf5g.jpeg?q=70,3.5,TECH-,"8,490","15,999",Desktop PC
24,APPLE 2021 iMac with 4.5K Retina display M1 (8 GB Unified/256 GB SSD/Mac OS Big Sur/24 Inch Screen/MGPC3HN/A),https://rukminim2.flixcart.com/image/612/612/kp1imq80/allinone-desktop/u/m/3/mgtf3hn-a-apple-original-imag3d5thhhfgtyg.jpeg?q=70,4.1,APPLE,"1,30,990","1,39,900",Desktop PC
25,ENTWINO Intel Core i3 (4 GB DDR3/500 GB/120 GB SSD/Windows 10 Home/1 GB/18.5 Inch Screen/ENTI3-550-4GB_500-120-18.5LED) with MS Office,https://rukminim2.flixcart.com/image/612/612/kua4r680/desktop-computer/o/w/t/intechvisioni32102-intechvision-original-imag7fv2sngkkghn.jpeg?q=70,3.8,ENTWINO,"10,799","19,999",Desktop PC
26,HP All-in-One Ryzen 3 Dual Core (4 GB DDR4/512 GB SSD/Windows 11 Home/AMD Radeon Graphics/21.5 Inch Screen/22-dd0786in) with MS Office,https://rukminim2.flixcart.com/image/612/612/xif0q/allinone-desktop/8/l/z/22-dd0786in-hp-original-imagnyk9h7hhjqfh.jpeg?q=70,4.2,HP,"41,610","52,990",Desktop PC
27,ZOONIS Gaming Pc With 16GB DDR3 Ram/ DDR-5 4GB Graphics Card Core i7 (4th Gen) (16 GB DDR4/512 GB SSD/Windows 10 Pro/4 GB/22 Inch Screen/Alain Free Fire Gaming Pc) with MS Office,https://rukminim2.flixcart.com/image/612/612/xif0q/allinone-desktop/g/f/l/alain-free-fire-gaming-pc-zoonis-original-imagkebveqsjbvyy.jpeg?q=70,4.0,ZOONIS,"31,597","59,999",Desktop PC
28,"Assembled Gaming & Editing Desktops Core i5 (750) Core i5 (8 GB DDR3/500 GB/128 GB SSD/Windows 10 Pro/2 GB/19 Inch Screen/Gaming & Editing Desktops Core i5 -750, 128GB SSD)",https://rukminim2.flixcart.com/image/612/612/xif0q/allinone-desktop/r/u/w/gaming-editing-desktops-core-i5-750-128gb-ssd-assembled-original-imagtngvh2e2rtfx.jpeg?q=70,2.8,Assembled,"18,999","49,999",Desktop PC
29,"ZOONIS Gaming & Editing Desktops Core i5 (4th Gen) (8 GB DDR3/500 GB/256 GB SSD/Windows 10 Pro/4 GB/22 Inch Screen/Free Fire Gaming Desktop Complete Set With 22"" Led Rgb Light Keyboard Mouse) with MS Office",https://rukminim2.flixcart.com/image/612/612/xif0q/allinone-desktop/u/w/e/free-fire-gaming-desktop-complete-set-with-22-led-rgb-light-original-imagqspjbtyhv5jf.jpeg?q=70,3.7,ZOONIS,"22,999","64,890",Desktop PC
30,TECH- Assemblers Home & Office Core i3 (8 GB DDR3/500 GB/128 GB SSD/Windows 10 Pro/19 Inch Screen/MA-10 Best Besktop For Office & Online Work and Home Education) with MS Office,https://rukminim2.flixcart.com/image/612/612/xif0q/allinone-desktop/e/u/5/ma-10-best-besktop-for-office-online-work-and-home-education-original-imagqr5hhqzyttzr.jpeg?q=70,3.3,TECH-,"11,589","29,999",Desktop PC
31,brozzo Gaming & YouTube Editing Desktop With RGB Keyboard Core i5 (6th Gen) (16 GB DDR4/500 GB/256 GB SSD/Windows 10 Pro/4 GB/22 Inch Screen/G/01-Gaming & YouTube Editing Desktop With RGB Keyboard) with MS Office,https://rukminim2.flixcart.com/image/612/612/xif0q/allinone-desktop/3/g/o/g-01-black-gaming-youtube-editing-desktop-brozzo-original-imagz94yvgatv4us.jpeg?q=70,3.2,brozzo,"26,304","59,999",Desktop PC
32,mansi all in onepc ALL IN ONE Core 2 Duo (4 GB DDR3/320 GB/Windows 7 Professional/15.6 Inch Screen/ZEBRONICS DESKTOP COMPUTERS),https://rukminim2.flixcart.com/image/612/612/kwfaj680/allinone-desktop/y/k/1/assemb-zeneric-assembled-original-imag93schmftkhcj.jpeg?q=70,3.5,mansi,"7,407","23,900",Desktop PC
33,DZAB Intel Core i7 (8 GB DDR3/512 GB SSD/Windows 10 Home/1 GB Onboard/20 Inch Screen/D-i726008GB512SSD20LED),https://rukminim2.flixcart.com/image/612/612/xif0q/allinone-desktop/o/k/w/d-i726008gb512ssd20led-dzab-original-imagqnuy7snksyd8.jpeg?q=70,4.0,DZAB,"16,999","39,999",Desktop PC
34,"ASUS AiO A3 Series Touch Panel, Intel 12th Gen Core i5 (8 GB DDR4/512 GB SSD/Windows 11 Home/23.8 Inch Screen/A3402WBAT-WA001WS) with MS Office",https://rukminim2.flixcart.com/image/612/612/xif0q/allinone-desktop/y/o/q/-original-imagka5zb4mx3vud.jpeg?q=70,4.8,ASUS,"63,990","83,990",Desktop PC
35,TECH- Assemblers Intel Core 2 Duo (4 GB DDR2/500 GB/Windows 7 Ultimate/512 MB/15.4 Inch Screen/Online Class Computer 01),https://rukminim2.flixcart.com/image/612/612/xif0q/allinone-desktop/v/h/o/online-class-computer-01-tech-assemblers-original-imagry4xys3ghgb3.jpeg?q=70,3.1,TECH-,"8,645","30,999",Desktop PC
36,"ASUS AiO A3 Series All in One Desktop, Intel 12th Gen Core i5 (8 GB DDR4/512 GB SSD/Windows 11 Home/21.45 Inch Screen/A3202WBAK-BA003WS) with MS Office",https://rukminim2.flixcart.com/image/612/612/xif0q/allinone-desktop/a/6/s/-original-imagu4zquhu6u39z.jpeg?q=70,4.2,ASUS,"51,990","71,990",Desktop PC
37,FusionIT 2100 Core i3 (8 GB DDR3/256 GB SSD/Windows 11 Home/17 Inch Screen/ASSEMBLED PC) with MS Office,https://rukminim2.flixcart.com/image/612/612/xif0q/allinone-desktop/n/k/7/assembled-pc-keyboard-and-mouse-usb-fusionit-original-imagw7b4qm2quzkh.jpeg?q=70,3.7,FusionIT,"10,999","32,999",Desktop PC
38,brozzo Home & Office Core i5 (8 GB DDR3/500 GB/128 GB SSD/Windows 10 Pro/19 Inch Screen/i5 (8 GB DDR3/500 GB/120 GB SSD/Windows 10 Home/512 MB/18.5 Inch Screen) with MS Office,https://rukminim2.flixcart.com/image/612/612/xif0q/allinone-desktop/g/b/2/i5-8-gb-ddr3-500-gb-120-gb-ssd-windows-10-home-512-mb-18-5-inch-original-imagtmerxbsja3c3.jpeg?q=70,3.3,brozzo,"13,489","49,999",Desktop PC
39,APPLE iMac Core i5 (7th Gen) (8 GB Unified/256 GB SSD/Mac OS Big Sur/21.5 Inch Screen/MHK03HN/A),https://rukminim2.flixcart.com/image/612/612/ktlu9ow0/allinone-desktop/6/p/q/mhk03hn-a-apple-original-imag6xfhaxggptbk.jpeg?q=70,4.3,APPLE,"92,990","99,900",Desktop PC
40,ENTWINO Intel Core i3 (8 GB DDR3/500 GB/120 GB SSD/Windows 10 Home/512 MB/18.5 Inch Screen/ENTI3-550-8GB_500-120-18.5LED) with MS Office,https://rukminim2.flixcart.com/image/612/612/kwzap3k0/allinone-desktop/p/a/z/aic-i5-650-8gb-500-120-18-5led-dzab-original-imag9jyzhgrpqxxp.jpeg?q=70,3.8,ENTWINO,"13,077","29,999",Desktop PC
41,ZOONIS Gaming desktop Core i5 (8 GB DDR3/500 GB/128 GB SSD/Windows 10 Pro/2 GB/22 Inch Screen/Alain) with MS Office,https://rukminim2.flixcart.com/image/612/612/xif0q/allinone-desktop/y/g/o/alain-zoonis-original-imaghhyrcgczppte.jpeg?q=70,3.3,ZOONIS,"28,999","49,999",Desktop PC
42,"Punta Seltos Core™ i5-3270 Processor with 128GB SSD ,500GB Hard Disk Core i5 (8 GB DDR3/500 GB/128 GB SSD/Windows 10 Pro/18.5 Inch Screen/i5-3270(3rd Generation) with 4 Cores 4MB Cache With Seltos) with MS Office",https://rukminim2.flixcart.com/image/612/612/xif0q/allinone-desktop/y/0/m/core-i3-4170-processor-punta-original-imaggvkxbkyefhzj.jpeg?q=70,3.2,Punta,"15,200","29,999",Desktop PC
43,TECH- Assemblers Z Core i3 (8 GB DDR3/500 GB/119 GB SSD/Windows 10 Pro/1 GB/18.5 Inch Screen/3 3rd/500gb/8gb/wifi/12ssd),https://rukminim2.flixcart.com/image/612/612/xif0q/allinone-desktop/b/e/j/3-3rd-500gb-8gb-wifi-12ssd-tech-assemblers-original-imagqtmfysesngfw.jpeg?q=70,3.7,TECH-,"11,552","34,999",Desktop PC
44,ZOONIS Home & Office Core i3 (8 GB DDR3/500 GB/128 GB SSD/Windows 10 Pro/19 Inch Screen/MA-10 Best Besktop For Office & Online Work and Home Education) with MS Office,https://rukminim2.flixcart.com/image/612/612/xif0q/allinone-desktop/x/w/5/ma-10-best-besktop-for-office-online-work-and-home-education-original-imagzu6gu6824jqg.jpeg?q=70,3.3,ZOONIS,"11,999","29,999",Desktop PC
45,ZOONIS Best For Free Fire Game & Video Editing Desktop Core i5 (8 GB DDR3/512 GB SSD/Windows 10 Pro/4 GB/22 Inch Screen/Gaming Pc -01 Best For Free Fire Game & Video Editing Desktop) with MS Office,https://rukminim2.flixcart.com/image/612/612/xif0q/allinone-desktop/w/m/s/gaming-editing-desktops-core-i5-4th-gen-zoonis-original-imagrvkxpt4px88p.jpeg?q=70,4.2,ZOONIS,"21,992","59,999",Desktop PC
46,Connect Infotech Assemble Desktop Core i3 (8 GB DDR3/1 TB/240 GB SSD/Windows 7 Professional/18.5 Inch Screen/I3 3rd Generation Processor 8GB RAM 1TB HDD 240GB SSD 18.5 Inch LED),https://rukminim2.flixcart.com/image/612/612/kj0bp8w0-0/allinone-desktop/d/p/m/i5-3rd-generation-processor-16gb-ram-1tb-hdd-120gb-ssd-18-5-inch-original-imafyzggwyvhyxrw.jpeg?q=70,3.3,Connect,"17,190","59,000",Desktop PC
47,INTECHVISION Intel Core i3 (8 GB DDR3/500 GB/120 GB SSD/Windows 10 Home/512 MB/18.5 Inch Screen/IN_I3-550-8-550GB-120-185) with MS Office,https://rukminim2.flixcart.com/image/612/612/kwqq1zk0/desktop-computer/h/m/z/0-i3-550-8gb-500gb-18-5-dzab-original-imag9cg5tbutpagt.jpeg?q=70,3.8,INTECHVISION,"10,799","29,999",Desktop PC
48,ASUS Pentium Quad Core (4 GB DDR3/1 TB/Windows 10 Home/21.5 Inch Screen/V221IDUK-BA175T),https://rukminim2.flixcart.com/image/612/612/jq4353k0/allinone-desktop/z/9/t/asus-v221iduk-ba166t-original-imafc6z4sjwtghkp.jpeg?q=70,4.2,ASUS,"15,390","31,091",Desktop PC
49,ENTWINO Intel Core i7 (8 GB DDR3/1 TB/256 GB SSD/Windows 10 Home/4 GB NVidia GRAPHIC CARD DDR5/22 Inch Screen/GAMING-COMPUTER-I7-2600-8GB_1TB) with MS Office,https://rukminim2.flixcart.com/image/612/612/xif0q/allinone-desktop/r/w/o/gaming-computer-i7-2600-8gb-1tb-entwino-original-imagjnwhj68btb6w.jpeg?q=70,3.3,ENTWINO,"22,599","59,999",Desktop PC
50,TECH- Assemblers Intel Core i3 (4 GB DDR3/500 GB/Windows 10 Pro/15.1 Inch Screen/ASZI35004GB),https://rukminim2.flixcart.com/image/612/612/xif0q/allinone-desktop/u/u/o/aszi35004gb-tech-assemblers-original-imagqr6yz7hyg4us.jpeg?q=70,3.7,TECH-,"9,554","19,999",Desktop PC
51,"TECH- Assemblers Assembled Desktop Computer Celeron Dual Core (4 GB DDR3/320 GB/Windows 10 Pro/15.4 Inch Screen/Assembled Desktop Computer, Intel Dual Core 2.6 Ghz Pentium Processor) with MS Office",https://rukminim2.flixcart.com/image/612/612/xif0q/allinone-desktop/s/w/i/assembled-desktop-computer-intel-dual-core-2-6-ghz-pentium-original-imagh8gwqnyjdzzp.jpeg?q=70,3.0,TECH-,"11,601","29,999",Desktop PC
52,DZAB Intel Core i5 (8 GB DDR3/500 GB/Windows 10 Home/1 GB/17 Inch Screen/AIC-I5-2400-8GB_500HDD-17LED),https://rukminim2.flixcart.com/image/612/612/xif0q/allinone-desktop/q/g/t/aic-i5-2400-8gb-500hdd-17led-dzab-original-imagqhgzvnfmm4kv.jpeg?q=70,3.3,DZAB,"9,999","24,999",Desktop PC
53,ZOONIS Office & Home Core i5 (8 GB DDR3/500 GB/Windows 10 Pro/19 Inch Screen/Office & Home Core i5 G-01) with MS Office,https://rukminim2.flixcart.com/image/612/612/xif0q/allinone-desktop/a/1/o/g-01-pink-white-office-home-core-i5-zoonis-original-imagpyb8jemvg9gc.jpeg?q=70,3.0,ZOONIS,"14,378","29,999",Desktop PC
54,DZAB Assembled Computer Core 2 Duo (4 GB DDR3/500 GB/120 GB SSD/Windows 10 Home/512 MB/15.1 Inch Screen/Assemebled C2D Computer Online Class),https://rukminim2.flixcart.com/image/612/612/xif0q/allinone-desktop/i/1/8/assemebled-c2d-computer-online-class-dzab-original-imagh2hpkgaxnt4g.jpeg?q=70,3.6,DZAB,"10,249","21,999",Desktop PC
55,brozzo Gaming & YouTube Editing Desktop With 2GB Graphics Card Core i5 (4th Gen) (8 GB DDR3/500 GB/128 GB SSD/Windows 10 Pro/2 GB/19 Inch Screen/G-01/Black Gaming & YouTube Editing Desktop) with MS Office,https://rukminim2.flixcart.com/image/612/612/xif0q/allinone-desktop/3/g/o/g-01-black-gaming-youtube-editing-desktop-brozzo-original-imagz94yvgatv4us.jpeg?q=70,4.1,brozzo,"23,343","48,999",Desktop PC
56,brozzo G-01/Light Gaming Desktop for Gaming & Editing Core i5 (8 GB DDR3/500 GB/128 GB SSD/Windows 10 Pro/2 GB/19 Inch Screen/G-01/Light Gaming Desktop for Gaming & Editing) with MS Office,https://rukminim2.flixcart.com/image/612/612/xif0q/allinone-desktop/w/w/5/g-01-light-gaming-desktop-for-gaming-editing-brozzo-original-imagpwkfgxucgmek.jpeg?q=70,3.3,brozzo,"18,799","44,999",Desktop PC
57,HP All-in-One 27 Core i3 (8 GB DDR4/512 GB SSD/Windows 11 Home/27 Inch Screen/All-in-One 27-CB1345IN) with MS Office,https://rukminim2.flixcart.com/image/612/612/xif0q/allinone-desktop/z/o/z/all-in-one-27-cb1345in-hp-original-imagntpzpvkvktgg.jpeg?q=70,4.8,HP,"53,990","61,500",Desktop PC
58,DZAB Intel Core i5 (8 GB DDR3/Windows 10 Home/1 GB/20 Inch Screen/DZB-i52400-8GB-512SSD-20LED),https://rukminim2.flixcart.com/image/612/612/xif0q/allinone-desktop/i/q/w/dzb-i52400-8gb-512ssd-20led-dzab-original-imagqpyh77aqnruv.jpeg?q=70,3.3,DZAB,"14,899","34,999",Desktop PC
59,ZOONIS Office & Home Core i5 (8 GB DDR3/500 GB/128 GB SSD/Windows 10 Pro/512 MB/19 Inch Screen/G1-01/I5-650-8GB_500-120-18.5LED) with MS Office,https://rukminim2.flixcart.com/image/612/612/xif0q/allinone-desktop/m/0/f/g1-01-i5-650-8gb-500-120-18-5led-zoonis-original-imagmkfgquhmgczg.jpeg?q=70,3.1,ZOONIS,"13,047","29,999",Desktop PC
60,HP All-in-One Core i3 (8 GB DDR4/1 TB/256 GB SSD/Windows 11 Home/21.5 Inch Screen/22-dd2456),https://rukminim2.flixcart.com/image/612/612/xif0q/allinone-desktop/v/1/b/-original-imagg6fhxwfzq4ct.jpeg?q=70,4.5,HP,"53,899","62,990",Desktop PC
61,INTECHVISION Intel Core i3 (4 GB DDR3/500 GB/120 GB SSD/Windows 10 Home/512 MB/18.5 Inch Screen/DZABAllinone Core i3),https://rukminim2.flixcart.com/image/612/612/kua4r680/desktop-computer/o/w/t/intechvisioni32102-intechvision-original-imag7fv2sngkkghn.jpeg?q=70,4.0,INTECHVISION,"9,999","27,999",Desktop PC
62,ENTWINO Intel Core 2 Duo (4 GB DDR2/500 GB/Free DOS/512 MB/15.4 Inch Screen/EntwinoAllInOneWithWifiCore2Duo),https://rukminim2.flixcart.com/image/612/612/kox8b680/allinone-desktop/n/e/s/entwinoallinonewithwificore2duo-entwino-original-imag39w4m8sthmgc.jpeg?q=70,3.5,ENTWINO,"9,499","29,000",Desktop PC
63,HP All-in-One Core i3 (8 GB DDR4/Windows 11 Home/23.8 Inch Screen/24-cb1802in),https://rukminim2.flixcart.com/image/612/612/xif0q/allinone-desktop/q/x/4/24-cb1907in-hp-original-imagnymvygqhfyem.jpeg?q=70,4.8,HP,"51,990","59,909",Desktop PC
64,DZAB Intel Core i5 (8 GB DDR3/500 GB/120 GB SSD/Windows 10 Home/512 MB/18.5 Inch Screen/AIC-I5-650-8GB_500-120-18.5LED),https://rukminim2.flixcart.com/image/612/612/kwzap3k0/allinone-desktop/p/a/z/aic-i5-650-8gb-500-120-18-5led-dzab-original-imag9jyzhgrpqxxp.jpeg?q=70,3.3,DZAB,"12,999","29,999",Desktop PC
65,DZAB Assembled Computer Core i3 (4 GB DDR3/500 GB/120 GB SSD/Windows 10 Home/512 MB/18.5 Inch Screen/DZABAllinone Core i3),https://rukminim2.flixcart.com/image/612/612/kua4r680/desktop-computer/o/w/t/intechvisioni32102-intechvision-original-imag7fv2sngkkghn.jpeg?q=70,3.4,DZAB,"9,999","21,999",Desktop PC
66,"ASUS AiO A3 Series All in One Desktop, Intel 12th Gen Core i3 (8 GB DDR4/512 GB SSD/Windows 11 Home/21.45 Inch Screen/A3202WBAK-BA004WS) with MS Office",https://rukminim2.flixcart.com/image/612/612/xif0q/allinone-desktop/a/6/s/-original-imagu4zquhu6u39z.jpeg?q=70,4.5,ASUS,"42,990","63,990",Desktop PC
67,ENTWINO Intel Core i7 (8 GB DDR3/500 GB/120 GB SSD/Windows 10 Home/1 GB/19 Inch Screen/ENTAIC-I7-2600-8GB_500-120-19LED) with MS Office,https://rukminim2.flixcart.com/image/612/612/xif0q/allinone-desktop/d/u/v/entaic-i7-2600-8gb-500-120-19led-entwino-original-imagjfke322hn8nf.jpeg?q=70,3.5,ENTWINO,"24,999","49,599",Desktop PC
68,Punta Sonet Gaming Desktop Core i5 (8 GB DDR3/512 GB SSD/Windows 10 Pro/2 GB/20 Inch Screen/Gaming Desktop) with MS Office,https://rukminim2.flixcart.com/image/612/612/xif0q/allinone-desktop/o/r/n/gaming-desktop-punta-original-imagk4a2tesrvts6.jpeg?q=70,3.2,Punta,"19,999","29,999",Desktop PC
69,TECH- Assemblers Intel Core 2 Duo (4 GB DDR3/500 GB/Windows 7 Ultimate/512 MB/15.6 Inch Screen/C2D/500/4GB),https://rukminim2.flixcart.com/image/612/612/xif0q/allinone-desktop/t/f/f/c2d-500-4gb-tech-assemblers-original-imagqr7ybey9xqt4.jpeg?q=70,3.3,TECH-,"8,917","29,990",Desktop PC
70,rionix intel Core i3 (8 GB DDR3/500 GB/120 GB SSD/Windows 10 Home/512 MB/18.5 Inch Screen/Core i3-8gb-1tb-18.5) with MS Office,https://rukminim2.flixcart.com/image/612/612/xif0q/allinone-desktop/t/a/w/190-10-190-08-g2-rionix-original-imagsfb3cnq3fgz6.jpeg?q=70,4.0,rionix,"10,337","45,999",Desktop PC
71,TECH- Assemblers Intel Core 2 Duo (4 GB DDR3/500 GB/Windows 7 Ultimate/512 MB/15.6 Inch Screen/C2D/500/4GB_4),https://rukminim2.flixcart.com/image/612/612/xif0q/allinone-desktop/v/4/a/c2d-500-4gb-tech-assemblers-original-imagryfw5tkz5fr6.jpeg?q=70,3.5,TECH-,"9,488","29,990",Desktop PC
72,ASSEMBLD 6000 Core i3 (6th Gen) (8 GB DDR4/512 GB SSD/Windows 11 Home/22 Inch Screen/ASSEMBLED SYSTEM) with MS Office,https://rukminim2.flixcart.com/image/612/612/xif0q/allinone-desktop/a/b/3/assembled-pc-assembld-original-imagn2c8ag62ryfy.jpeg?q=70,3.3,ASSEMBLD,"19,190","48,999",Desktop PC
73,"TECH- Assemblers Core2Duo Series Core 2 Duo (4 GB DDR3/1 TB/Windows 10 Pro/1 GB/15.6 Inch Screen/1 GB graphic|Free DOS|Core 2 Duo|[15.6, 23.0)|4 GB)",https://rukminim2.flixcart.com/image/612/612/kpr8k280/allinone-desktop/i/b/4/1-gb-graphic-free-dos-core-2-duo-15-6-23-0-4-gb-tech-assemblers-original-imag3x27bz2akyyy.jpeg?q=70,2.8,TECH-,"11,999","25,666",Desktop PC
74,ASSEMBLD 4000 Core i5 (4th Gen) (16 GB DDR4/1 TB/128 GB SSD/Windows 11 Home/22 Inch Screen/ASSEMBLED SYSTEM) with MS Office,https://rukminim2.flixcart.com/image/612/612/xif0q/allinone-desktop/b/h/1/desktop-wifi-bluetooth-2gb-graphic-assembled-original-imagp2q5bkbjzcqp.jpeg?q=70,3.6,ASSEMBLD,"18,035","54,999",Desktop PC
75,"TECH- Assemblers Intel Core 2 Duo (4 GB DDR3/500 GB/Windows 7 Professional/512 MB/15.6 Inch Screen/1 GB|Free DOS|Core 2 Duo|[15.6, 23.0)|4.0_BL)",https://rukminim2.flixcart.com/image/612/612/kpr8k280/allinone-desktop/7/u/o/1-gb-free-dos-core-2-duo-15-6-23-0-4-0-bl-tech-assemblers-original-imag3xyxdrtnzgvy.jpeg?q=70,3.3,TECH-,"8,999","21,599",Desktop PC
76,rionix G2 Core i3 (4 GB DDR2/500 GB/120 GB SSD/Windows 10 Pro/15 Inch Screen/190-10/190-08/ G2),https://rukminim2.flixcart.com/image/612/612/xif0q/allinone-desktop/t/a/w/190-10-190-08-g2-rionix-original-imagsfb3cnq3fgz6.jpeg?q=70,3.2,rionix,"8,500","28,999",Desktop PC
77,Refurbish PC Dell 3010 Intel I5-2400 Core i5 (8 GB DDR3/1 TB/256 GB SSD/Windows 11 Home/0 Inch Screen/Refurbished PC_Keyboard and Mouse Dell New) with MS Office,https://rukminim2.flixcart.com/image/612/612/xif0q/allinone-desktop/7/y/h/refurbished-pc-keyboard-and-mouse-dell-refurb-original-imagtefgmfdgavym.jpeg?q=70,3.8,Refurbish,"17,540","89,990",Desktop PC
78,FusionIT 2000 Core i3 (8 GB DDR3/1 TB/128 GB SSD/Windows 11 Home/2 GB/20 Inch Screen/Fusion IT 2120 / Keyboard and Mouse / Wifi and Bluetooth) with MS Office,https://rukminim2.flixcart.com/image/612/612/xif0q/allinone-desktop/u/c/a/fusion-it-2120-keyboard-and-mouse-wifi-and-bluetooth-fusionit-original-imagr9z8zpyan8fg.jpeg?q=70,2.7,FusionIT,"13,700","59,000",Desktop PC
