,Product_Name,Source,Ratings,Brand,Price,Actual_price,Category
1065,"HP DeskJet Ink Advantage Ultra 4929
All-in-One Printer Multi-function WiFi Color Inkjet Printer",https://rukminim2.flixcart.com/image/612/612/xif0q/printer/k/f/c/-original-imaguy2ngszh5j3c.jpeg?q=70,4.2,HP,"7,899","10,796",Printers
1067,Canon PIXMA G670 Multi-function WiFi Color Ink Tank Printer,https://rukminim2.flixcart.com/image/612/612/ky0g58w0/printer/x/y/h/pixma-g670-canon-original-imagac8va4ykhrn3.jpeg?q=70,4.5,Canon,"20,999","24,800",Printers
1071,HP Smart Tank 675 All-in-One Printer Multi-function WiFi Color Inkjet Printer with Voice Activated Printing Google Assistant and Alexa,https://rukminim2.flixcart.com/image/612/612/l111lzk0/printer/y/m/h/smart-tank-675-all-in-one-printer-hp-original-imagczycpp35mh6z.jpeg?q=70,4.2,HP,"18,599","21,801",Printers
1072,"Epson Eco Tank L3260 Multi-function WiFi Color Ink Tank Printer (Color Page Cost: 24 Paise | Black Page Cost: 12 Paise) with extended warranty of 3 years or 30,000 pages*",https://rukminim2.flixcart.com/image/612/612/xif0q/printer/e/y/q/eco-tank-l3260-epson-original-imagn4ejzkphgcyd.jpeg?q=70,3.9,Epson,"17,999","18,999",Printers
1075,Epson M2110 Multi-function Monochrome Inkjet Printer (Black Page Cost: 15 Paise),https://rukminim2.flixcart.com/image/612/612/l1xwqkw0/printer/u/l/a/m2110-epson-original-imagdebsszztggnf.jpeg?q=70,4.1,Epson,"18,499","19,700",Printers
1076,"HP DeskJet Ink Advantage 2335 Multi-function Color Inkjet Printer for Dependable printing and scanning, simple setup for everyday usage, Ideal for Home",https://rukminim2.flixcart.com/image/612/612/kd94uq80/printer/7/n/a/hp-deskjet-ia-2335-original-imafu6gdg7r2pxmq.jpeg?q=70,3.8,HP,"5,399","6,979",Printers
1077,HP Smart Tank 750 All-in-One Duplex Wifi High Capacity Inktank Multi-function WiFi Color Inkjet Printer with Voice Activated Printing Google Assistant and Alexa (Borderless Printing),https://rukminim2.flixcart.com/image/612/612/kuof5ow0/printer/f/d/c/6uu47a-hp-original-imag7qu3shz7qdgd.jpeg?q=70,4.0,HP,"24,499","25,159",Printers
1080,Epson M1100 Single Function Monochrome Ink Tank Printer (Black Page Cost: 15 Paise),https://rukminim2.flixcart.com/image/612/612/xif0q/printer/j/r/w/-original-imagqsnynpvkrswq.jpeg?q=70,4.1,Epson,"11,550","12,599",Printers
1081,Epson EcoTank Monochrome M1120 Wi-Fi InkTank Printer Single Function Monochrome Ink Tank Printer (Black Page Cost: 15 Paise),https://rukminim2.flixcart.com/image/612/612/k0igia80/printer/n/n/h/epson-ecotank-monochrome-m1120-wi-fi-inktank-printer-original-imafk9y5gwtzm6sw.jpeg?q=70,3.9,Epson,"12,299","12,999",Printers
1082,brother DCP-T520W Multi-function WiFi Color Ink Tank Printer (Borderless Printing),https://rukminim2.flixcart.com/image/612/612/kh9gbrk0/printer/f/a/r/brother-dcp-t520w-original-imafxamynygfejhz.jpeg?q=70,4.3,brother,"15,999","17,600",Printers
1083,HP MFP 1188W Multi-function WiFi Monochrome Laser Printer,https://rukminim2.flixcart.com/image/612/612/xif0q/printer/d/i/t/mfp-1188w-hp-original-imagprnyfcgjqgvj.jpeg?q=70,3.8,HP,"19,299","22,772",Printers
1084,Epson L5290 Multi-function WiFi Color Inkjet Printer (Color Page Cost: 18 Paise | Black Page Cost: 7 Paise | Borderless Printing),https://rukminim2.flixcart.com/image/612/612/l0h1g280/printer/k/m/n/l5290-epson-original-imagc9fd9w5edszx.jpeg?q=70,4.6,Epson,"22,499","25,999",Printers
1085,Epson M1120 Single Function WiFi Monochrome Ink Tank Printer (Black Page Cost: 15 Paise),https://rukminim2.flixcart.com/image/612/612/l1xwqkw0/printer/d/i/x/m1120-epson-original-imagdec32czymqgb.jpeg?q=70,4.3,Epson,"12,299","13,699",Printers
1086,Epson L6460 Multi-function WiFi Color Ink Tank Printer (Color Page Cost: 12 Paise | Black Page Cost: 24 Paise),https://rukminim2.flixcart.com/image/612/612/l1xwqkw0/printer/l/d/q/l6460-epson-original-imagdebtdjgfcuxm.jpeg?q=70,4.2,Epson,"29,349","29,999",Printers
1087,brother HL-B2000D Single Function Monochrome Laser Printer (Borderless Printing),https://rukminim2.flixcart.com/image/612/612/xif0q/printer/f/w/j/-original-imagtzvzjwffhzes.jpeg?q=70,4.4,brother,"12,549","13,990",Printers
1088,brother DCP-L2541DW IND Multi-function WiFi Monochrome Laser Printer,https://rukminim2.flixcart.com/image/612/612/xif0q/printer/q/o/x/-original-imagtzvzkzgu8nkn.jpeg?q=70,4.3,brother,"25,450","26,500",Printers
1089,HP Ink Tank 319 Multi-function Color Ink Tank Printer (Color Page Cost: 20 Paise | Black Page Cost: 10 Paise),https://rukminim2.flixcart.com/image/612/612/xif0q/printer/h/0/0/-original-imagzyb59e5mauez.jpeg?q=70,4.2,HP,"12,889","15,990",Printers
1090,HP Smart Tank 670 All-in-One Multi-function Color Ink Tank Printer with Automatic Ink Sensor & Wireless Integrated,https://rukminim2.flixcart.com/image/612/612/xif0q/printer/x/e/r/-original-imagnzgb4hyzhnkk.jpeg?q=70,4.3,HP,"17,599","20,263",Printers
1091,Canon PIXMA MegaTank G570 Single Function WiFi Color Ink Tank Printer,https://rukminim2.flixcart.com/image/612/612/xif0q/printer/g/v/n/-original-imagmg3sqgrgpgyu.jpeg?q=70,4.0,Canon,"15,999","19,490",Printers
1092,brother HL-B2080DW Single Function Monochrome Laser Printer,https://rukminim2.flixcart.com/image/612/612/xif0q/printer/d/b/a/-original-imagtzvzdyvhjshq.jpeg?q=70,4.5,brother,"15,449","16,790",Printers
1093,HP DeskJet Ink Advantage 2876 All-in-One Multi-function WiFi Color Inkjet Printer,https://rukminim2.flixcart.com/image/612/612/xif0q/printer/7/w/d/-original-imagtxh5he5yhesc.jpeg?q=70,3.8,HP,"6,699","9,317",Printers
1094,Epson M1180 Single Function WiFi Monochrome Inkjet Printer (Black Page Cost: 15 Paise | Borderless Printing),https://rukminim2.flixcart.com/image/612/612/kkbh8cw0/printer/a/n/j/m1180-epson-original-imafzp7wchxj5qhh.jpeg?q=70,4.5,Epson,"15,799","22,999",Printers
1095,HP Deskjet Ink Advantage 1515 All-in-One Printer,https://rukminim2.flixcart.com/image/612/612/xif0q/printer/w/o/u/-original-imagw4gdwgwgf2dn.jpeg?q=70,4.2,HP,"4,715","5,723",Printers
1096,Canon MF272dw Multi-function WiFi Monochrome Laser Printer,https://rukminim2.flixcart.com/image/612/612/xif0q/printer/0/q/i/mf272dw-canon-original-imagpgsfwtqqzqbb.jpeg?q=70,4.1,Canon,"22,499","32,695",Printers
1097,Canon G2021 Multi-function Color Ink Tank Printer,https://rukminim2.flixcart.com/image/612/612/klgx0280/printer/c/c/j/g3021-canon-original-imagyh8sgvrujzsx.jpeg?q=70,4.3,Canon,"13,549","15,685",Printers
1098,Canon PIXMA MegaTank GM4070 Multi-function WiFi Monochrome Inkjet Printer (Borderless Printing),https://rukminim2.flixcart.com/image/612/612/k48rwcw0/printer/z/b/y/canon-gm4070-original-imafn72znrvhkgtg.jpeg?q=70,4.4,Canon,"17,999","20,570",Printers
1099,HP INK TANK WIRELESS 419 Multi-function WiFi Color Ink Tank Printer with Voice Activated Printing Google Assistant and Alexa (Color Page Cost: 20 Paise | Black Page Cost: 10 Paise),https://rukminim2.flixcart.com/image/612/612/xif0q/printer/k/g/8/-original-imagnzgbqzkwzuq4.jpeg?q=70,4.3,HP,"14,899","17,227",Printers
1102,HP LaserJet Tank MFP 1005 Printer Multi-function Monochrome Laser Printer,https://rukminim2.flixcart.com/image/612/612/l111lzk0/printer/h/a/f/laserjet-tank-mfp-1005-printer-hp-original-imagczxunf7x6sbt.jpeg?q=70,3.9,HP,"20,657","23,633",Printers
1103,HP MFP 1188A Multi-function Monochrome Laser Printer,https://rukminim2.flixcart.com/image/612/612/xif0q/printer/d/i/t/mfp-1188w-hp-original-imagprnyfcgjqgvj.jpeg?q=70,3.8,HP,"16,699","20,343",Printers
1104,HP DeskJet Ink Advantage 2878 All-in-One Multi-function WiFi Color Inkjet Printer,https://rukminim2.flixcart.com/image/612/612/xif0q/printer/x/m/j/-original-imagtxgyhxybqkpr.jpeg?q=70,3.8,HP,"6,699","9,317",Printers
1105,HP Smart Tank 581 Multi-function WiFi Color Ink Tank Printer,https://rukminim2.flixcart.com/image/612/612/xif0q/printer/n/q/j/smart-tank-581-hp-original-imagzyrhhnyzhs2q.jpeg?q=70,4.0,HP,"16,249","18,848",Printers
1108,HP DeskJet Ink Advantage 4278 All-in-One Multi-function WiFi Color Inkjet Printer,https://rukminim2.flixcart.com/image/612/612/xif0q/printer/r/g/n/-original-imagtxh2nk3spyfk.jpeg?q=70,3.7,HP,"7,499","10,389",Printers
1111,Epson M100 Single Function Monochrome Ink Tank Printer,https://rukminim2.flixcart.com/image/612/612/jiqb8nk0/printer/f/3/f/epson-m100-original-imaf6fpxzqhbcygh.jpeg?q=70,4.5,Epson,"12,399","12,999",Printers
1114,Canon imageCLASS LBP6030B Single Function Monochrome Laser Printer,https://rukminim2.flixcart.com/image/612/612/kuof5ow0/printer/r/m/i/imageclass-lbp6030b-canon-original-imag7qub3unccjmb.jpeg?q=70,4.2,Canon,"13,199","13,499",Printers
1117,"SAMSUNG Sl-M2021 Single Function Printer (White, Toner Cartridge) Single Function Monochrome Laser Printer",https://rukminim2.flixcart.com/image/612/612/k3bwrrk0/printer/7/z/g/samsung-sl-m2021-single-function-printer-white-toner-cartridge-original-imafmhe8t8zaefvh.jpeg?q=70,2.0,SAMSUNG,"7,200","7,294",Printers
1118,HP Smart Tank 515 Multi-function WiFi Color Ink Tank Printer with Voice Activated Printing Google Assistant and Alexa (Color Page Cost: 20 Paise | Black Page Cost: 10 Paise),https://rukminim2.flixcart.com/image/612/612/xif0q/printer/b/h/a/-original-imagzyb5hj3btbak.jpeg?q=70,4.2,HP,"16,699","18,361",Printers
1119,HP MFP M329dw (W1A24A) Printer Multi-function Monochrome Laser Printer,https://rukminim2.flixcart.com/image/612/612/l4n2oi80/printer/6/d/2/laserjet-pro-mfp-m329dn-w1a23a-hp-original-imagfhngurkeqxze.jpeg?q=70,4.1,HP,"32,925","42,999",Printers
1120,Epson L3215 Multi-function Color Ink Tank Printer (Color Page Cost: 9 Paise | Black Page Cost: 24 Paise),https://rukminim2.flixcart.com/image/612/612/xif0q/printer/b/b/b/c11cj68509-epson-original-imagh85ggfz2jxfh.jpeg?q=70,4.0,Epson,"13,999","18,999",Printers
1121,Canon Pixma G3010 Multi-function WiFi Color Ink Tank Printer,https://rukminim2.flixcart.com/image/612/612/xif0q/printer/m/a/a/pixma-g3010-canon-original-imagmy4tmj3uznnu.jpeg?q=70,4.0,Canon,"16,799","17,595",Printers
1122,Canon ImageCLASS LBP6030w Single Function Monochrome Laser Printer,https://rukminim2.flixcart.com/image/612/612/kwzap3k0/printer/k/e/g/imageclass-lbp6030w-canon-original-imafwsd8xfdefu6s.jpeg?q=70,4.5,Canon,"14,199","14,999",Printers
1123,Epson M205 Multi-function WiFi Monochrome Ink Tank Printer (Black Page Cost: 15 Paise),https://rukminim2.flixcart.com/image/612/612/xif0q/printer/n/p/k/-original-imagqsnyybam8egg.jpeg?q=70,4.2,Epson,"13,799","14,599",Printers
1124,Canon G3010 Multi-function Color Inkjet Printer,https://rukminim2.flixcart.com/image/612/612/kkwwu4w0/printer/v/h/a/g3010-canon-original-imagy5hrupfz5kbg.jpeg?q=70,4.2,Canon,"15,800","18,000",Printers
1127,brother DCP-T510W IND Multi-function WiFi Color Inkjet Printer (Color Page Cost: 26 Paise | Black Page Cost: 10 Paise | Borderless Printing),https://rukminim2.flixcart.com/image/612/612/kabe9ow0/printer/r/z/c/brother-dcp-t510w-ind-original-imafrx67cubyegtn.jpeg?q=70,4.3,brother,"12,000","13,490",Printers
1128,brother DCP-T220 Multi-function Color Ink Tank Printer (Borderless Printing),https://rukminim2.flixcart.com/image/612/612/kh9gbrk0/printer/k/m/z/brother-dcp-t220-original-imafxamymwz4fzry.jpeg?q=70,4.1,brother,"12,980","13,990",Printers
1133,brother DCP-T420W All-in One Ink Tank Refill System Printer Multi-function WiFi Color Ink Tank Printer,https://rukminim2.flixcart.com/image/612/612/xif0q/printer/9/r/c/dcp-t420w-all-in-one-ink-tank-refill-system-printer-brother-original-imagnwyhgrphggge.jpeg?q=70,4.3,brother,"14,285","17,999",Printers
1136,Canon PIXMA MegaTank G670 Multi-function WiFi Color Ink Tank Printer,https://rukminim2.flixcart.com/image/612/612/ks7tuvk0/printer/p/i/k/pixma-g670-canon-original-imag5tweskrjhmpe.jpeg?q=70,4.1,Canon,"20,999","27,195",Printers
1137,brother DCP-T220 All-in One System Multi-function Color Ink Tank Printer,https://rukminim2.flixcart.com/image/612/612/xif0q/printer/2/j/r/dcp-t220-all-in-one-system-brother-original-imagpmfhzzg5vphm.jpeg?q=70,4.0,brother,"12,799","13,990",Printers
1140,Xerox B210 Single Function WiFi Monochrome Laser Printer,https://rukminim2.flixcart.com/image/612/612/kgtqhe80/printer/q/h/w/xerox-b210-original-imafwyg7eqy8c2pa.jpeg?q=70,4.0,Xerox,"14,299","19,444",Printers
1141,Canon PIXMA G3770 Multi-function WiFi Color Inkjet Printer,https://rukminim2.flixcart.com/image/612/612/xif0q/printer/y/h/k/pixma-g3770-canon-original-imagz878ajpxvut9.jpeg?q=70,4.0,Canon,"18,898","20,270",Printers
1142,HP Smart Tank 516 All-in-One Multi-function WiFi Color Inkjet Printer,https://rukminim2.flixcart.com/image/612/612/xif0q/printer/z/i/s/-original-imagnuwefdcuxxph.jpeg?q=70,4.2,HP,"17,600","19,305",Printers
1143,Canon PIXMA MegaTank GM2070 Single Function WiFi Monochrome Ink Tank Printer with Voice Activated Printing Google Assistant and Alexa with Auto-Duplex & Optional Color Printing,https://rukminim2.flixcart.com/image/612/612/l5iid8w0/printer/l/z/7/-original-imagg6cmyt9yfvta.jpeg?q=70,4.1,Canon,"14,999","15,785",Printers
1144,Canon PIXMA MegaTank G1737 Single Function Color Ink Tank Printer with Black (135 ml) & Color (70 ml) ink bottles,https://rukminim2.flixcart.com/image/612/612/xif0q/printer/r/z/l/-original-imags7tkcfhcnbxk.jpeg?q=70,5.0,Canon,"11,389","13,845",Printers
1145,Epson EcoTank Monochrome M2140 Multi-function Color Inkjet Printer,https://rukminim2.flixcart.com/image/612/612/k1cgr680/printer/a/5/s/epson-ecotank-monochrome-m2140-original-imafkxmatxyzydtg.jpeg?q=70,4.0,Epson,"19,999","23,400",Printers
1146,Epson M2120 Multi-function WiFi Monochrome Ink Tank Printer (Black Page Cost: 15 Paise),https://rukminim2.flixcart.com/image/612/612/l1xwqkw0/printer/h/8/g/m2120-epson-original-imagde22aksthrf6.jpeg?q=70,4.1,Epson,"16,399","19,399",Printers
1149,brother DCP-T520W All-in One Ink Tank printer Multi-function WiFi Color Ink Tank Printer,https://rukminim2.flixcart.com/image/612/612/xif0q/printer/d/z/x/dcp-t520w-all-in-one-ink-tank-printer-brother-original-imagnjs3hrfhsyhk.jpeg?q=70,3.4,brother,"15,999","18,999",Printers
1154,HP Laserjet MFP M233sdw Printer Multi-function Monochrome Laser Printer,https://rukminim2.flixcart.com/image/612/612/xif0q/printer/y/r/h/laserjet-mfp-m233sdw-printer-hp-original-imaggkq5jfc2vf2u.jpeg?q=70,4.3,HP,"26,100","30,644",Printers
1155,"Epson L4260 Multi-function WiFi Color Ink Tank Printer (Color Page Cost: 30 Paise | Black Page Cost: 12 Paise) with extended warranty of 3 years or 30,000 pages*",https://rukminim2.flixcart.com/image/612/612/kyt0ya80/printer/s/q/f/l4260-epson-original-imagaykvxhuezcus.jpeg?q=70,4.3,Epson,"22,800","27,330",Printers
1156,HP 108W Single Function WiFi Monochrome Laser Printer,https://rukminim2.flixcart.com/image/612/612/l5e81ow0/printer/u/n/j/108w-hp-original-imagg34zubgyafhs.jpeg?q=70,5.0,HP,"16,990","18,000",Printers
1159,HP Laser MFP 138fnw Multi-function WiFi Monochrome Laser Printer,https://rukminim2.flixcart.com/image/612/612/kshtxu80/printer/l/m/b/hplaser-mfp-138fnw-hp-original-imag6fwhzqtcrcke.jpeg?q=70,3.1,HP,"22,100","24,598",Printers
1162,brother FAX-2840 Multi-function Monochrome Laser Printer (Color Page Cost: 2 Paise | Black Page Cost: 2 Paise),https://rukminim2.flixcart.com/image/612/612/printer/f/y/g/brother-fax-2840-original-imaedq2hgcythmy4.jpeg?q=70,3.0,brother,"18,599","24,890",Printers
1163,Canon PIXMA E3177 Multi-function WiFi Color Inkjet Printer (Borderless Printing),https://rukminim2.flixcart.com/image/612/612/j95y4cw0/printer/y/u/q/canon-pixma-e3177-original-imaezynucmxb8rbh.jpeg?q=70,4.0,Canon,"3,200","5,605",Printers
1164,brother DCP-T820DW - Wi-Fi & Auto Duplex Color Ink Multi-function WiFi Color Ink Tank Printer,https://rukminim2.flixcart.com/image/612/612/xif0q/printer/g/a/v/dcp-t820dw-wi-fi-auto-duplex-color-ink-brother-original-imagz9ehvxpywvsd.jpeg?q=70,3.9,brother,"20,699","39,999",Printers
1165,Epson M15140 Multi-function WiFi Monochrome Inkjet Printer,https://rukminim2.flixcart.com/image/612/612/l4vnbm80/printer/s/b/s/m15140-epson-original-imagfzmvaa7wrtxr.jpeg?q=70,3.0,Epson,"59,800","78,999",Printers
1166,Epson Monochrome 3170 Multi-function WiFi Monochrome Laser Printer,https://rukminim2.flixcart.com/image/612/612/klqx30w0/printer/t/x/c/monochrome-epson-original-imagyt3kgapaayjr.jpeg?q=70,4.3,Epson,"27,700","29,000",Printers
1167,Epson Ink Tank M200 Multi-function Monochrome Ink Tank Printer (Black Page Cost: 12),https://rukminim2.flixcart.com/image/612/612/printer/h/c/3/epson-m200-original-imaemyd9ywfu8rnm.jpeg?q=70,3.9,Epson,"17,000","19,899",Printers
1168,HP Smart Tank 210 Single Function WiFi Color Ink Tank Printer,https://rukminim2.flixcart.com/image/612/612/xif0q/printer/s/g/h/smart-tank-210-hp-original-imagzyrmzzpgs3bc.jpeg?q=70,4.0,HP,"10,599","13,500",Printers
1177,Canon imageCLASS MF232w Multi-function WiFi Monochrome Laser Printer,https://rukminim2.flixcart.com/image/612/612/kb89ea80/printer/b/n/y/canon-imageclass-mf232w-original-imafsmk9ftbzaghc.jpeg?q=70,4.3,Canon,"16,999","20,519",Printers
1180,Canon imageCLASS MF241d Multi-function Monochrome Laser Printer,https://rukminim2.flixcart.com/image/612/612/kb89ea80/printer/z/h/p/canon-imageclass-mf241d-original-imafsmk944kj4ufm.jpeg?q=70,4.3,Canon,"17,799","21,609",Printers
1181,Canon MF235 Multi-function WiFi Color Laser Printer,https://rukminim2.flixcart.com/image/612/612/j2nlwnk0/printer/g/y/e/canon-mf235-original-imaetytu5hrc7nqc.jpeg?q=70,1.0,Canon,"20,517","26,249",Printers
1182,SAMSUNG Xpress M2060NW SL-M2060NW/XIP Multi-function WiFi Color Laser Printer,https://rukminim2.flixcart.com/image/612/612/jcatwnk0/printer/5/d/y/samsung-m2060nw-original-imaffgrq4syqsqvv.jpeg?q=70,3.5,SAMSUNG,"10,318","12,986",Printers
1183,Xerox P 3025 Multi-function WiFi Monochrome Laser Printer,https://rukminim2.flixcart.com/image/612/612/jjrgosw0/printer/z/w/g/xerox-p-3025-original-imaf79d6mnczqjfe.jpeg?q=70,3.4,Xerox,"19,011","19,870",Printers
1184,brother MFC-T910DW Multi-function WiFi Color Inkjet Printer (Color Page Cost: 26 Paise | Black Page Cost: 10 Paise | Borderless Printing),https://rukminim2.flixcart.com/image/612/612/ke4kjgw0/printer/u/r/s/brother-mfc-t910dw-original-imafuvbyxygpkk5m.jpeg?q=70,4.6,brother,"21,999","23,990",Printers
1187,HP DeskJet Ink Advantage 2138 Multi-function Color Inkjet Printer,https://rukminim2.flixcart.com/image/612/612/k0lbdzk0pkrrdj/printer-refurbished/8/g/j/b-deskjet-ink-advantage-2138-hp-original-imafbu3y7tjpgx4w.jpeg?q=70,4.1,HP,"5,838","6,187",Printers
1188,HP ScanJet Pro 3000 s4 Sheet-Feed Scanner Multi-function WiFi Color Laser Printer,https://rukminim2.flixcart.com/image/612/612/xif0q/printer/w/h/i/scanjet-pro-3000-s4-sheet-feed-scanner-hp-original-imaggbzfpypd7fuq.jpeg?q=70,5.0,HP,"34,200","40,093",Printers
1193,HP MFP 136a Multi-function Monochrome Laser Printer,https://rukminim2.flixcart.com/image/612/612/kwmfqfk0/printer/f/c/y/laserjet-136a-hp-original-imag9999c76zzw8t.jpeg?q=70,4.6,HP,"16,790","19,000",Printers
1198,HP 150 Wired Mouse Wired Optical Mouse,https://rukminim2.flixcart.com/image/612/612/l1v1uvk0/mouse/v/r/u/-original-imagdc3zxnbjfxec.jpeg?q=70,4.3,HP,289,399,Mouse Or Trackballs
1199,"Logitech G102 Light Sync / Adj DPI Upto 8000, 6 Programmable Buttons, RGB Wired Optical  Gaming Mouse",https://rukminim2.flixcart.com/image/612/612/kp1imq80/mouse/6/9/j/g102-light-sync-logitech-original-imag3d4rzzzyrfxd.jpeg?q=70,4.5,Logitech,"1,295","1,995",Mouse Or Trackballs
1200,Arctic Fox Wired USB Gaming Mouse with Breathing Lights and DPI Upto 3600 Wired Optical  Gaming Mouse,https://rukminim2.flixcart.com/image/612/612/xif0q/mouse/d/l/l/wired-usb-gaming-mouse-with-breathing-lights-and-dpi-upto-3600-original-imagg6btapfaxtzh.jpeg?q=70,4.3,Arctic,199,599,Mouse Or Trackballs
1201,Portronics Toad 14 Wireless Optical Mouse,https://rukminim2.flixcart.com/image/612/612/kxhvf680/mouse/d/1/p/toad-14-portronics-original-imag9xnpexundzez.jpeg?q=70,4.1,Portronics,249,499,Mouse Or Trackballs
1202,"Portronics Toad 13, POR 1381 Wireless Optical Mouse",https://rukminim2.flixcart.com/image/612/612/kt4ozgw0/mouse/a/d/l/toad-13-portronics-original-imag6jqawv8zhpum.jpeg?q=70,4.1,Portronics,289,499,Mouse Or Trackballs
1203,HP 1000 Wired Optical Mouse,https://rukminim2.flixcart.com/image/612/612/jrkyfm80/mouse/h/u/f/hp-1000-original-imafd3jqy5sygn2s.jpeg?q=70,4.3,HP,249,399,Mouse Or Trackballs
1204,"Portronics Toad 13, POR 1382 Wireless Optical Mouse",https://rukminim2.flixcart.com/image/612/612/kw9krrk0/mouse/v/p/h/toad-13-portronics-original-imag8zbqqkgmb9d6.jpeg?q=70,4.1,Portronics,289,499,Mouse Or Trackballs
1205,"HP X200 / Perfect Palm fit., built-in battery indicator, upto 1600 DPI Wireless Laser Mouse",https://rukminim2.flixcart.com/image/612/612/l1v1uvk0/mouse/d/t/4/-original-imagdc3vuafgqcej.jpeg?q=70,4.3,HP,619,899,Mouse Or Trackballs
1206,RPM Euro Games Rechargeable - 500 mAh Battery | Upto 3200 DPI | 6 Buttons | Backlit RGB Wireless Optical  Gaming Mouse,https://rukminim2.flixcart.com/image/612/612/kxnl6kw0/mouse/5/8/m/wireless-gaming-mouse-rechargeable-500-mah-battery-upto-3200-dpi-original-imaga2da9yxvenhc.jpeg?q=70,4.2,RPM,499,"1,490",Mouse Or Trackballs
1207,"ASUS WT200 / WT200 Ergonomic Design, 1200 dpi Wireless Optical Mouse",https://rukminim2.flixcart.com/image/612/612/xif0q/mouse/b/a/p/-original-imagtugayfsz9jdf.jpeg?q=70,4.2,ASUS,399,"1,990",Mouse Or Trackballs
1208,HP Z3700 Wireless Optical Mouse Wireless Optical Mouse,https://rukminim2.flixcart.com/image/612/612/jr58l8w0/mouse/8/3/2/zebronics-zeb3463466-original-imaf6f5ureypsrfb.jpeg?q=70,4.6,HP,"1,190","1,546",Mouse Or Trackballs
1209,"HP M120 /6 programm. buttons,1 AA battery gives upto 12 months life,upto 1600 DPI Wireless Mechanical Mouse",https://rukminim2.flixcart.com/image/612/612/xif0q/mouse/j/g/o/7j4g4aa-hp-original-imagrwgnkzmqzrxu.jpeg?q=70,4.2,HP,539,999,Mouse Or Trackballs
1210,"Logitech B175 / Optical Tracking, 12-Months Battery Life, Ambidextrous Wireless Optical Mouse",https://rukminim2.flixcart.com/image/612/612/korijrk0/mouse/j/p/k/b175-logitech-original-imag359v76rygsaf.jpeg?q=70,4.5,Logitech,599,995,Mouse Or Trackballs
1211,"HP Z3700 /Slim form with USB receiver,16 month battery life, 1200DPI Wireless Optical Mouse",https://rukminim2.flixcart.com/image/612/612/xif0q/mouse/o/j/q/-original-imagv2w37capjxdz.jpeg?q=70,4.4,HP,809,"1,199",Mouse Or Trackballs
1212,DELL MS 116-BK Wired Optical Mouse,https://rukminim2.flixcart.com/image/612/612/k4a7c7k0/mouse/m/h/t/dell-ms116-wired-optical-mouse-3yrs-warranty-original-imafmktgxyt5ge9k.jpeg?q=70,4.4,DELL,309,650,Mouse Or Trackballs
1213,"Portronics Toad 24, POR 1611 Wireless Optical Mouse",https://rukminim2.flixcart.com/image/612/612/l3lx8cw0/mouse/i/o/f/toad-24-with-adjustable-dpi-portronics-original-imagepfzkggpsxz9.jpeg?q=70,4.2,Portronics,319,599,Mouse Or Trackballs
1214,"Logitech M171 / Optical Tracking, Ambidextrous Wireless Optical Mouse",https://rukminim2.flixcart.com/image/612/612/kz7bcsw0/mouse/m/k/i/-original-imagb9kgqhzfpxyr.jpeg?q=70,4.5,Logitech,545,845,Mouse Or Trackballs
1215,Lenovo KB MICE_BO 300 USB Mouse Wired Optical Mouse,https://rukminim2.flixcart.com/image/612/612/ju8oxow0/mouse-refurbished/6/b/z/c-optical-mouse-kb-mice-bo-lenovo-300-usb-mouse-lenovo-original-imaf9hpfxkrf4sdh.jpeg?q=70,4.4,Lenovo,271,389,Mouse Or Trackballs
1216,Intex USB ECO-8 Wired Optical Mouse,https://rukminim2.flixcart.com/image/612/612/xif0q/mouse/k/p/g/-original-imagz4zfsaqz52am.jpeg?q=70,3.9,Intex,99,249,Mouse Or Trackballs
1217,"HP Z3700 /Slim form with USB receiver,16 month battery life, 1200DPI Wireless Optical Mouse",https://rukminim2.flixcart.com/image/612/612/xif0q/mouse/1/2/k/-original-imagv2w3ktgn8z7h.jpeg?q=70,4.4,HP,809,"1,798",Mouse Or Trackballs
1218,"Logitech M220 / Silent Buttons, 1000 DPI Tracking, Ambidextrous Wireless Optical Mouse",https://rukminim2.flixcart.com/image/612/612/kpzt7680/mouse/v/s/k/m220-silent-logitech-original-imag43yrry4jhhhp.jpeg?q=70,4.4,Logitech,799,"1,098",Mouse Or Trackballs
1219,Lenovo 130 Wireless Optical Mouse,https://rukminim2.flixcart.com/image/612/612/krqoknk0/mouse/d/d/u/130-lenovo-original-imag5gpygcrbxnhq.jpeg?q=70,4.4,Lenovo,620,"1,090",Mouse Or Trackballs
1220,"HP S1000 Silent / Lightweight, upto 1600 DPI Wireless Optical Mouse",https://rukminim2.flixcart.com/image/612/612/k0e66q80/mouse/u/8/6/hp-s1000-original-imafk74z7xnkmqyx.jpeg?q=70,4.3,HP,479,899,Mouse Or Trackballs
1221,Logitech B100 Wired Optical Mouse,https://rukminim2.flixcart.com/image/612/612/l3xcr680/mouse/o/x/q/-original-imagexpzksp4qdc6.jpeg?q=70,4.4,Logitech,269,375,Mouse Or Trackballs
1222,Portronics Toad 23 Adjustable DPI 2.4GHz Wireless Optical Mouse,https://rukminim2.flixcart.com/image/612/612/l3khsi80/mouse/x/r/s/toad-23-adjustable-dpi-2-4ghz-portronics-original-imagenxwgzsqub38.jpeg?q=70,4.2,Portronics,299,599,Mouse Or Trackballs
1223,DELL WM118 Wireless Optical Mouse,https://rukminim2.flixcart.com/image/612/612/ju8oxow0/mouse-refurbished/9/e/p/c-optical-mouse-wm118-dell-original-imaf8gusxcrkneuy.jpeg?q=70,4.4,DELL,649,999,Mouse Or Trackballs
1224,HP M100 Wired Optical  Gaming Mouse,https://rukminim2.flixcart.com/image/612/612/xif0q/mouse/7/f/t/-original-imagn3f9dwuqwqyt.jpeg?q=70,4.4,HP,439,599,Mouse Or Trackballs
1225,HP M270 Wired Optical  Gaming Mouse,https://rukminim2.flixcart.com/image/612/612/k7nnrm80/mouse/u/d/z/hp-m270-gaming-mouse-original-imafpupd8wwzefjm.jpeg?q=70,4.4,HP,390,699,Mouse Or Trackballs
1226,"Razer Death Adder Essential / Lightweight(96gms) ,Chroma Lighting,upto 6400 DPI Wired Optical  Gaming Mouse",https://rukminim2.flixcart.com/image/612/612/xif0q/mouse/n/d/g/razer-deathadder-essential-white-edition-6400-dpi-ergonomic-original-imaggyvu9gqrazsg.jpeg?q=70,4.5,Razer,"1,299","4,499",Mouse Or Trackballs
1227,"HP Z3700 Wireless Optical Mouse (2.4GHz Wireless, Silver) Wireless Optical Mouse",https://rukminim2.flixcart.com/image/612/612/kxxl9jk0/mouse/7/d/6/z3700-wireless-optical-mouse-2-4ghz-wireless-silver-hp-original-imaga9tgxewwnf2h.jpeg?q=70,4.2,HP,"1,499","1,798",Mouse Or Trackballs
